182,Karmada 是否支持用户自定义是否要调度回恢复的集群？为什么？,目前社区的方向是，将来可能会提供给客户选择是否重调度的能力。考虑到重调度对应用稳定性的影响，目前没有调度回原集群的原因。
183,Karmada 如何实现集群级别的高可用？,Karmada 实现了基于故障转移模式、容器生命周期钩子和客户端负载均衡等机制来实现集群级别的高可用。
184,Karmada 如何实现跨云服务商的多云管理？,Karmada 通过将不同云提供商的 Kubernetes 集群连接到一个控制平面上，将不同云提供商的 Kubernetes 集群组合成一个虚拟的超级集群。
185,Karmada 的核心功能是什么？,Karmada 的核心功能是集群间应用编排和调度管理，支持多云服务商、多种容器编排工具和多种部署模式。
186,Karmada 是什么？,Karmada 是一个开源的多云应用编排和调度平台，旨在使基于云原生技术的应用程序可以跨越多个云提供商进行部署和管理。
187,Karmada 中的 Execution 控制器是做什么的？,Execution 控制器是负责将成员集群对应执行命名空间的 Work 中存放的实际需要下发的资源在对应成员集群创建、更新或删除。
188,Karmada 中如何实现故障转移？,故障转移是由多个控制器和调度器协同完成的，当集群发生故障后，其他集群会接管这部分工作，保证应用的高可用性。
189,Karmada 中的 Scheduler 控制器是做什么的？,Scheduler 控制器是负责将用户提交的 Work 调度到合适的集群上，并根据调度策略进行副本拆分或全量部署。
190,Karmada 中的 ClusterPlan 控制器是做什么的？,ClusterPlan 控制器是负责将用户提交的 ClusterPlan 转换为对应的 Kubernetes 资源，并在集群中创建这些资源。
191,Karmada 可以实现什么功能？,Karmada 可以实现跨云平台部署、编排和调度应用程序，并支持故障转移和副本拆分等功能。
192,Karmada 基于哪个 Kubernetes 版本开发？,Karmada 版本发布与 Kubernetes 版本发布没有直接关联，但是目前稳定版本是基于 Kubernetes 1.19.0 开发的。
193,Karmada 是什么？,Karmada 是一个开源的、云原生多云应用管理平台，可以实现在多个云平台上部署、编排和调度应用程序。
194,什么是容器镜像？它包含哪些内容？,容器镜像是一个不可改变的静态文件，包含创建容器的依赖性。这些依赖可能包括一个可执行的二进制文件、系统库、系统工具、环境变量和其他必要的平台设置。
195,什么是 ConfigMap？它有哪些作用？,ConfigMap 是一种 API 对象，用来将非机密性的数据保存到键值对中。使用时可以用作环境变量、命令行参数或者存储卷中的配置文件。ConfigMap 将您的环境配置信息和容器镜像解耦，便于应用配置的修改。
196,什么是集群？,集群是运行容器化应用程序的一组计算节点。在 Kubernetes 中，集群通常运行多个节点，提供容错性和高可用性。
197,云提供商是什么？它们通常提供哪些服务？,云提供商是一个提供云计算平台的商业机构或其他组织。很多云提供商提供托管的基础设施（也称作基础设施即服务或 IaaS）。针对托管的基础设施，云提供商负责服务器、存储和网络，而用户负责管理其上运行的各层软件，例如运行一个 Kubernetes 集群。
198,什么是云原生技术？,云原生技术是用于构建云原生应用程序的技术，使组织能够在现代动态环境中构建和运行可扩缩的应用程序，他们坚持“云的承诺”并充分利用云计算的优势。
199,什么是混沌工程？,混沌工程或 CE 是在生产中对分布式系统进行实验的学科，以建立对系统承受动荡和意外情况时能力的信心。
200,什么是控制组？,控制组（cgroup）是一个 Linux 内核特性，对一组进程的资源使用（CPU、内存、磁盘 I/O 和网络等）进行限制、审计和隔离。
201,什么是证书？,证书是个安全加密文件，用来确认对 Kubernetes 集群访问的合法性。
202,什么是cAdvisor？,cAdvisor (Container Advisor) 是一个守护进程，负责收集、聚合、处理并输出运行中容器的信息。
203,什么是金丝雀部署？,金丝雀部署是一种部署策略，开始时有两个环境：一个有实时流量，另一个包含没有实时流量的更新代码。
204,什么是蓝绿部署？,"蓝绿部署是一种以最小的停机时间更新运行中的计算机系统的策略。运营商维护两个环境，被称为 ""蓝"" 和 ""绿""。一个为生产流量服务（所有用户目前正在使用的版本），而另一个则被更新。"
205,什么是裸机？,裸机是指一台物理计算机，更具体地说是一台服务器，它只有一个操作系统。
206,什么是自动扩缩？,自动扩缩通常是指在计算资源方面，系统能够进行自动扩缩的能力。自动扩缩系统可在需要时自动添置资源，通过扩缩来满足不断变化的用户需求。
207,什么是授权？,授权指将用户完成具体工作所需的权限授予用户，授权通过系统角色或自定义角色的权限生效。用户获得具体的权限后，可以对资源或服务进行操作。
208,什么是审计日志？,审计日志提供了对系统中对象所做更改的历史记录。
209,什么是 Autoscaling？,Autoscaling 是指系统能够进行自动扩缩的能力。它通常基于不同指标进行配置，例如内存或处理时间，并在需要时自动添置资源，通过扩缩来满足不断变化的用户需求。
210,什么是 App Container？,App Container 是在 Pod 中运行部分工作负载的容器。与 Init 容器不同，它是在 Init 容器启动完毕后才开始启动。如果 Pod 没有配置 Init 容器，则该 Pod 中的所有容器都是应用程序容器。
211,什么是 API-initiated eviction？,API-initiated eviction 是一种先调用 Eviction API 创建驱逐对象，再通过该对象优雅地中止 Pod 的过程。它可以通过 kube-apiserver 的客户端直接调用 Eviction API 发起驱逐。
212,什么是 Admission Controller？,Admission Controller 是在请求通过认证和鉴权之后、对象被持久化之前拦截到达 API 服务器的请求。它可以执行验证和/或变更操作，限制创建、删除、修改对象的请求。
213,什么是 Abstraction？,Abstraction 是一种对服务的消费，隐藏服务的细节，使整个系统更通用也更容易理解。
214,CSIStorageCapacity的哪个API版本在v1.27中被移除？,CSIStorageCapacity的storage.k8s.io/v1beta1 API版本在v1.27中被移除。
215,KMSv2升级为Beta，在插件key ID不变的情况下，重用DEK数据加密密钥的优化有什么好处？,KMSv2升级为Beta，在插件key ID不变的情况下，重用DEK数据加密密钥可以减少DEK重新生成所需的时间和计算资源开销。该优化在服务器启动时进行重新随机生成。
216,将SelfSubjectReview提升为哪个级别？,将SelfSubjectReview提升为Beta级别。
217,AdmissionWebhookMatchConditions功能已进入哪个阶段？,AdmissionWebhookMatchConditions功能已进入Alpha阶段，在v1Beta和v1 API中，为ValidatingWebhookConfiguration和MutatingWebhookConfiguration添加了MatchConditions字段。
218,在v1.27中，Kubernetes为聚合发现提供了什么支持？,在v1.27中，Kubernetes为聚合发现提供了Beta支持，通过/api和/apis发布集群支持的所有资源，而不是每个Group分别提供。
219,什么是ValidatingAdmissionPolicy？,ValidatingAdmissionPolicy是一个新资源，在Kubernetes v1.25提供了KEP-2876 CRD验证表达式语言后引入。它允许进行字段验证时不使用Validation Webhook，并支持自定义匹配条件等功能。
220,Indexed Job的API验证已放宽，允许通过同时更改哪两个参数来扩展或者缩小Indexed Job？,Indexed Job的API验证已放宽，允许通过同时更改parallelism和completions来扩展或者缩小Indexed Job，但需要保持parallelism == completions同步修改。
221,CronJob支持哪个功能进阶至GA？,CronJob支持Timezone功能进阶至GA。
222,StatefulSetStartOrdinal功能升级为Beta，允许在StatefulSet中配置起始序号，这个序号指的是什么？,StatefulSetStartOrdinal功能升级为Beta，默认允许在StatefulSet中配置起始序号。这个序号指的是StatefulSet中第一个Pod的索引。
223,什么是 PodDisruptionBudget，新添加了哪个字段？,PodDisruptionBudget是控制在进行节点维护或节点故障期间终止Pod的数量的机制。新添加了unhealthyPodEvictionPolicy字段，用于指定不健康Pod应该发生什么行为。该字段在v1.27中升级为Beta。
224,DaoCloud 在 Kubernetes v1.27 中贡献了哪些功能？,DaoCloud 在 Kubernetes v1.27 中重点贡献了 sig-node、sig-scheduling 和 kubeadm 相关的内容。具体包括修复尝试获取 leader lease 的等待时间的问题、\nMinDomainsInPodTopologySpread 功能升级为 Beta、Kubeadm 添加特性门控 EtcdLearnerMode 等。此外，DaoCloud 还参与了上百个问题修复和功能研发，并有多名研发工程师取得不少成就。
225,什么是 kubectl apply --prune 功能？,kubectl apply --prune 功能是 Kubernetes 中用于自动清理 apply yaml 删除的部分对象的功能。在 v1.5 中引入了该功能作为 Alpha 版本，并在 v1.27 中进行了重新设计并升级为 Alpha 版本。新版本中增加了 --applyset 配合使用，并且能够更好地支持复杂场景。
226,什么是 NodeLogQuery 特性门控？,NodeLog
227,什么是 CustomResourceValidationExpressions？,CustomResourceValidationExpressions 是 Kubernetes 中一种用于验证 CRD 的规则。在 v1.25 中，CustomResourceValidationExpressions 已经升级为 Beta 版本。在 v1.27 中，ValidationRule 新增了字段 messageExpression，可以更好地展示验证提示信息。
228,什么是 PodTopologySpread 调度策略？,PodTopologySpread 调度策略是 Kubernetes 中的一种调度策略，它可以在滚动更新 Deployment 时，更加均匀地调度新的 Pod 实例。在 v1.27 中，PodTopologySpread 调度策略可以区分调度 Pod 标签的值，从而使得新的 Pod 实例被调度得更加均匀。
229,NodeLogQuery 特性门控提供了什么功能？,NodeLog
230,PodTopologySpread 调度策略如何区分新旧实例，能够解决什么问题？,PodTopologySpread 调度策略可以区分调度 Pod 标签的值，这样滚动更新后，新的 Pod 实例会被调度得更加均匀。这能够解决在滚动更新 Deployment 时新实例调度不均匀的问题。
231,Pod 资源的纵向弹性伸缩是在哪个版本中支持的？,Pod 资源的纵向弹性伸缩是在 1.25 版本中支持的。
232,APIServerTracing 已经升级为什么状态并默认启用？,APIServerTracing 已经升级为 Beta 状态并默认启用。
233,MinimizeIPTablesRestore 是解决什么问题而被引入的？在哪个版本引入，升级为 Beta 并默认启用在哪个版本中？,MinimizeIPTablesRestore 是解决大型集群中 kube-proxy 的 iptables 模式性能问题而被引入。该功能在 1.26 版本中引入，并在 1.27 版本中升级为 Beta 并默认启用。
234,Retain 和 Delete 行为针对哪种 StatefulSet 触发对应的 PVC 删除动作？,只有配置了 Delete 策略的 StatefulSet 在被删除时才会触发对应的 PVC 删除动作。
235,StatefulSetAutoDeletePVC 功能是在哪个版本引入的？,StatefulSetAutoDeletePVC 功能是在 v1.23 中引入的。
236,Kubernetes 容器镜像仓库域名已经从哪里更改为 registry.k8s.io？,Kubernetes 容器镜像仓库域名已经从 k8s.gcr.io 更改为 registry.k8s.io。
237,Kubernetes 1.27 中 enhancements 的数量比之前版本多了多少个？,Kubernetes 1.27 中跟踪了60个 enhancements，比之前版本都要多得多。
238,Kubernetes 1.27 是2023年的第几个版本？,Kubernetes 1.27 是2023年的第一个版本。
239,ArtifactHub、Harbor、Distribution、Porter等是关于什么技术性比克？,ArtifactHub、Harbor、Distribution、Porter等是关于工件存储技术性比克，主要用于存储、发布和保护用于生产目的的构建工件，缓存和分析第三方工件，存储源代码等。
240,什么是最薄可行平台（TVP）？,最薄可行平台是一个概念，保持一种谨慎的平衡：保持平台的小，同时平衡平台加速和简化软件交付效果之间的关系。
241,平台团队由哪些角色构成？,平台团队由平台产品经理、开发人员等角色构成，其他角色也可以成为平台团队的一部分。这些角色负责开发和维护平台功能的接口和体验。
242,平台能力提供者是谁？能力包括什么？,平台能力提供者是开发和维护平台提供的能力的组织或团队，能力包括基础设施、运行时或其他支持服务。
243,什么是平台？,平台是集成了开发和交付软件所需能力的实体，能够提供和管理通用能力，从而使开发人员和运营商更快地交付应用和服务。
244,什么是 TVP？,TVP 指最薄可行平台，保持一种谨慎的平衡：保持平台的小，和平台加速和简化软件交付效果之间的平衡。
245,平台团队由谁来管理？,平台团队由平台产品经理管理。
246,平台能力提供者可以是哪些组织或团队？,平台能力提供者可以是外部组织或内部团队。
247,一个好的平台反映了什么？,一个好的平台反映了其用户的需求。
248,谷歌的 DORA 研究所建议跟踪哪些指标？,部署频率、更改准备时间、故障后恢复服务时间、更改失败率。
249,平台的最终目标是什么？,平台的最终目标是更快地为客户提供商业价值。
250,什么是容器存储接口(CSI)？它有什么作用？,容器存储接口(CSI)定义了存储系统暴露给容器的标准接口。CSI允许存储驱动提供商为Kubernetes创建定制化的存储插件，而无需将这些插件的代码添加到Kubernetes代码仓库(外部插件)。要使用某个存储提供商的CSI驱动，您首先要将它部署到您的集群上。然后您才能创建使用该CSI驱动的StorageClass。
251,什么是CronJob？它有哪些功能？,CronJob管理定期运行的任务。与crontab文件中的一行命令类似，周期调度任务(CronJob)对象使用cron格式设置排期表。
252,什么是数据库即服务(DBaaS)？它有哪些优点？,数据库即服务(DBaaS)是由云运营商(公共或私有)管理的服务，支持应用程序而无需应用程序团队执行传统的数据库管理功能。DBaaS允许应用程序开发人员利用数据库而无需成为专家或聘请数据库管理员(DBA)来保持数据库最新状态。它帮助组织更快地开发企业级应用程序，并最大限度地降低数据库成本。
253,什么是DaemonSet？它的作用是什么？,DaemonSet确保Pod的副本在集群中的一组节点上运行。它用来部署系统守护进程，例如日志搜集和监控代理，这些进程通常必须运行在每个节点。
254,什么是 Contour？它在微服务网关中的作用是什么？,Contour是微服务网关的控制面，被部署为控制节点，充当Envoy的后端管理服务能力。它提供便捷的网关配置，支持动态配置更新，多集群部署能力。同时提供了HTTPProxy CRD用于增强Kubernetes Ingress的核心配置能力。
255,什么是周期调度任务（CronJob）？,周期调度任务管理定期运行的任务，类似于 crontab 文件中的一行命令，CronJob 对象使用 cron 格式设置排期表。
256,什么是容器运行时接口（CRI）和容器运行时（CR）？,CRI 是一组与节点上 kubelet 集成的容器运行时 API，是 kubelet 和容器运行时之间通信的主要协议。CR 是负责运行容器的组件，Kubernetes 支持许多容器运行环境，例如 containerd、cri-o 等。
257,什么是自定义资源定义（CRD）？,CRD 是一种 API 扩展方式，它通过定制化的代码给您的 Kubernetes API 服务器增加资源对象，无需编译完整的定制 API 服务器。当 Kubernetes 公开支持的 API 资源不能满足您的需要时，CRD 让您可以在自己的环境上扩展 Kubernetes API。
258,什么是控制平面？,控制平面是指容器编排层，它暴露 API 和接口来定义、部署容器和管理容器的生命周期。这个编排层是由多个不同的组件组成，例如 etcd、API 服务器、调度器、控制器管理器、云控制器管理器等。
259,什么是持续交付和持续部署？,持续交付是一种实践，其中代码的变化被自动部署到验收环境中（或者，在持续部署的情况下，部署到生产中）。持续部署通过将已经完成的软件直接部署到生产环境，比持续交付更进了一步。
260,如何安装 DCE 5.0 社区版？,执行以下步骤：\n1. 安装基础依赖：\n```bash\ncurl -LO https://proxy-qiniu-download-public.daocloud.io/DaoCloud_Enterprise/dce5/install_prerequisite.sh\nbash install_prerequisite.sh online community \n```\n2. 下载 dce5-installer：\n```bash\nexport VERSION=v0.5.0\ncurl -Lo ./dce5-installer https://proxy-qiniu-download-public.daocloud.io/DaoCloud_Enterprise/dce5/dce5-installer-$VERSION\nchmod +x ./dce5-installer \n```\n3. 确认节点的外部可达 IP 地址。\n4. 执行安装：\n- 如果浏览器跟 master 节点的 IP 可以直通，执行以下命令：\n```bash\n./dce5-installer install-app -z -k\n```\n- 如果 master 节点的 IP 是内网，请在公有云中为其创建外网可达的 IP，并在防火墙规则中允许 32088 端口的进出，并执行以下命令：\n```bash\n./dce5-installer install-app -z -k $外部IP:32088 # $外部IP 为 master 节点外网 IP。\n```
261,如何安装默认存储 CSI（使用本地存储）？,"执行以下命令：\n```bash\nwget https://raw.githubusercontent.com/rancher/local-path-provisioner/v0.0.24/deploy/local-path-storage.yaml # 下载 CSI 配置文件。\nsed -i ""s/image: rancher/image: docker.m.daocloud.io\/rancher/g"" local-path-storage.yaml # 替换 docker.io 为实际镜像。\nsed -i ""s/image: busybox/image: docker.m.daocloud.io\/busybox/g"" local-path-storage.yaml \nkubectl apply -f local-path-storage.yaml # 应用配置文件。\nkubectl get po -n local-path-storage -w # 等待 Pod 都 running。\nkubectl patch storageclass local-path -p ""{""metadata"": {""annotations"":{""storageclass.kubernetes.io/is-default-class"":""true""}}}"" # 把 local-path 设置为默认 SC。\nkubectl get sc # 可以看到形如：local-path (default)。\n```"
262,如何接入其他 worker 工作节点？,"在其他 worker 节点执行 join 命令。在上述 master 节点执行 `kubeadm init` 时最后会在屏幕打出：\n```bash\nkubeadm join $第一台master的IP:6443 --token p...7 --discovery-token-ca-cert-hash s....x\n```\n成功 join 之后，输出类似于：\n```none\nThis node has joined the cluster:\n* Certificate signing request was sent to apiserver and a response was received.\n* The Kubelet was informed of the new secure connection details.\nRun ""kubectl get nodes"" on the control-plane to see this node join the cluster.\n```\n在 master 节点确认节点都被接入，并且等待其都变为 Ready 状态：\n```bash\nkubectl get no -w # 等待节点状态变为 ready。\n```"
263,以 calico 为例，如何安装 CNI？,1. 先安装 calico-operator：\n```bash\nkubectl create -f https://raw.githubusercontent.com/projectcalico/calico/v3.25.1/manifests/tigera-operator.yaml\n```\n2. 再下发经过修改/配置过的 CR：\n```bash\ncurl -LO https://raw.githubusercontent.com/projectcalico/calico/v3.25.1/manifests/custom-resources.yaml # 下载配置文件模板\ngrep cidr custom-resources.yaml #打印出默认的CIDR\n# 请确认 calico 配置文件里的 CIDR 和之前 kubeadm init 时的 CIDR 是一致的！！！否则请修改!!!⚠️ \nvim custom-resources.yaml # 修改文件中的参数，如CIDR等。\nkubectl apply -f custom-resources.yaml # 执行修改后的配置文件。\n```\n3.等待部署成功：\n```bash\nkubectl get po -n calico-system -w # 等待 Pod 都 Running。\nkubectl get no # 可以看到第一个节点变为 ready 状态了。\n```
264,如何配置 kubeconfig 文件？,执行以下命令：\n```bash\nmkdir -p $HOME/.kube\nsudo cp -i /etc/kubernetes/admin.conf $HOME/.kube/config\nsudo chown $(id -u):$(id -g) $HOME/.kube/config\n```
265,安装Kubernetes组件的版本号是多少？,版本以 1.25.8 为例
266,安装Containerd后，如何修改Containerd的配置文件？,"```bash\n#删除自带的 config.toml\nmv /etc/containerd/config.toml /etc/containerd/config.toml.old\n#重新初始化配置\nsudo containerd config default | sudo tee /etc/containerd/config.toml\n#更新配置文件内容: 使用systemd作为cgroup 驱动，并且替代pause镜像地址\nsed -i ""s/SystemdCgroup\ =\ false/SystemdCgroup\ =\ true/"" /etc/containerd/config.toml\nsed -i ""s/k8s.gcr.io\/pause/k8s-gcr.m.daocloud.io\/pause/g"" /etc/containerd/config.toml # 老的 pause 地址\nsed -i ""s/registry.k8s.io\/pause/k8s-gcr.m.daocloud.io\/pause/g"" /etc/containerd/config.toml\nsudo systemctl daemon-reload \nsudo systemctl restart containerd \nsudo systemctl enable containerd\n```"
267,在安装容器运行时时，如何卸载系统预装的Podman？,`yum erase podman buildah -y`
268,适用于DCE 5.0社区版的Kubernetes版本是多少？,Kubernetes：1.25.8
269,在 Calico underlay 场景下，如何帮助 Deployment 等类型应用实现固定 IP 的需求？,利用 Spiderpool 的手动指定 IP 池功能即可。具体操作可以参考上文的代码示例。
270,Spiderpool 能否实现固定 IP 的需求？,可以，通过手动指定 IP 池并将其绑定到应用上，就可以让该应用固定使用该池中的某个特定 IP。
271,Spiderpool 的 IP 分配方式是什么？,默认情况下，Spiderpool 会从已配置的 IP 池中随机分配一个可用的 IP 给应用使用。
272,如何手动指定 IP 池？,需要先创建一个 IP 池对象，指定 IP 范围，然后在创建应用时通过注解 `ipam.spidernet.io/ippool` 指定该 IP 池。具体操作可以参考上文的代码示例。
273,如何查看 Kubernetes 集群中所有 IP 池？,使用命令 `kubectl get sp`
274,如何手动指定应用使用哪个 IP 池？,可以在应用的 Deployment 中添加注解 `ipam.spidernet.io/ippool`，并指定使用哪个 IP 池。
275,如何手动指定 IP 池？,需要创建一个名为 SpiderIPPool 的 CRD 资源，在该资源中指定 spec.subnet 和 spec.ips 两个参数，分别表示该 IP 池属于哪一个子网，以及固定 IP 地址范围。
276,如何使用 Spiderpool 自动池功能为应用固定 IP 池？,需要在应用的 Deployment 中添加以下注解：\n- `ipam.spidernet.io/subnet`：指定从哪个子网中自动创建 IP 池，并绑定到应用 Pod\n- `ipam.spidernet.io/ippool-ip-number`：指定 IP 池的 IP 总量，数量为比副本数多三个。
277,Spiderpool 主要具有哪些特点？,Spiderpool 主要具有以下几个特点：\n- 能为 Deployment、StatefulSet 类型自动化分配固定 IP 地址，并且做到 IP 地址数量随副本数量自动扩缩容\n- 以 CRD 方式管理、配置 IP 池，极大减少运维成本\n- 支持第三方控制器创建的 Pod\n- 支持为 Pod 多网卡指定不同子网
278,Spiderpool 是针对于哪种网络模式的 IP 地址管理需求而设计的？,Spiderpool 是针对于 Underlay 网络模式的 IP 地址管理需求而设计的。
279,Calico 的哪个注解可以实现 Pod 级别的 IP 固定？,`cni.projectcalico.org/ipAddrs`。
280,Calico 通过什么方式来实现集群外客户端访问 Pod？,Calico BGP 模式宣告 Pod 子网的路由到网关，来自集群外的客户端可以直接通过 Pod 的 IP 访问 Pod，同时还可以保留客户端的源 IP。
281,什么是 Calico？,Calico 是一套开源的网络和网络安全解决方案，也是作为 Kubernetes 容器网络解决方案 (CNI: Container Network Interface) 的一种实现。
282,Linux/arm 将会在 Kubernetes v1.27 中发布吗？为什么？,Linux/arm 将不会在 Kubernetes v1.27 中发布，因为使用 golang 1.20.2 构建时遇到问题。注意，arm64仍然支持。
283,Kubernetes 中哪个特性门控已经废弃，将在未来版本移除？,SecurityContextDeny 特性门控已经废弃，将在未来版本移除。
284,kube-controller-manager 中哪些命令行参数被移除？,kube-controller-manager 命令行参数 --enable-taint-manager 和 --pod-eviction-timeout 被移除。
285,CSIStorageCapacity 的哪个 API 版本已经被弃用，将在 Kubernetes v1.27 中被移除？,CSIStorageCapacity 的 storage.k8s.io/v1beta1 API 版本已经被弃用，将在 Kubernetes v1.27 中被移除。
286,本文提到了哪些需要重点关注的 Kubernetes 版本变化？,本文提到了需要重点关注的 Kubernetes 版本变化：IPv6DualStack 外部云供应商特性门控被删除，以及 k8s.gcr.io 重定向到 registry.k8s.io。
